{
  "version": "1.0",
  "runId": "create-20260906-issue20-chat",
  "phase": "component-plan",
  "gate": "component-reuse",
  "status": "pass",
  "summary": "Greenfield inventory verified (no canonical registry, no installed primitives, ajv-only toolchain): 20 requirements each carry a 9-field record with rung-ordered resolutions (native first, justified create/extend with rejected rungs); token roles cited by semantic name; state contracts cover every reachable matrix row with unreachable exclusions reasoned; no unjustified duplicate exists.",
  "recordedBy": "coordinator",
  "recordedAt": "2026-09-06T19:30:00Z",
  "evidenceRefs": [
    ".chromarelay/runs/create-20260906-issue20-chat/context/component-plan.md",
    ".chromarelay/runs/create-20260906-issue20-chat/context/component-state-contracts.md",
    ".chromarelay/runs/create-20260906-issue20-chat/context/state-matrix.md"
  ]
}
